Title,Sol#,Department/Ind.Agency,Sub-Tier,Office,PostedDate,Type,ArchiveDate,SetASideCode,ResponseDeadLine,NaicsCode,PopState,PopZip,PopCountry
"FY24 PROCUREMENT OF A TRAILER FOR NAVFAC FE, MISAWA",N4008424Q0011,DEPT OF DEFENSE,DEPT OF THE NAVY,NAVFACSYSCOM FAR EAST,07:58.9,Solicitation,7/24/2025,,2024-08-26T14:30:00+09:00,336212,,,JPN
"FY24 PROCUREMENT OF A TRAILER FOR NAVFAC FE, MISAWA",N4008424Q0011,DEPT OF DEFENSE,DEPT OF THE NAVY,NAVFACSYSCOM FAR EAST,47:42.1,Solicitation,7/24/2025,,2024-08-26T14:30:00+09:00,336212,,,JPN
"MLWR23-1044, Repair Army Patriot TOC, B2931, Kunsan AB",W90VN724RA015,DEPT OF DEFENSE,DEPT OF THE ARMY,0906 AQ CO     DET B CONTRACTI,53:34.8,Combined Synopsis/Solicitation,7/23/2025,,2024-08-14T13:00:00+09:00,238290,KR-45,96264,KOR
"MLWR24-1035, Support Construction for US Army Fran Tower, Kunsan AB",W90VN724RA013,DEPT OF DEFENSE,DEPT OF THE ARMY,0906 AQ CO     DET B CONTRACTI,50:58.2,Combined Synopsis/Solicitation,7/24/2025,,2024-08-14T13:00:00+09:00,238210,KR-45,96264,KOR
Medical Support Assistant (MSA) Services for Brian D. Allgood Army Community Hospital (BDAACH) and Various MTFs / Clinics throughout the South Korean Peninsula,W81K0224Q0087,DEPT OF DEFENSE,DEPT OF THE ARMY,W40M MRCO PACIFIC,40:31.1,Presolicitation,10-01-25,,2024-07-26T10:00:00-10:00,561110,,,KOR
UPS Maintenance,19UK5624Q0047,"STATE, DEPARTMENT OF","STATE, DEPARTMENT OF",U.S. EMBASSY LONDON,55:02.7,Combined Synopsis/Solicitation,12/31/2024,,2024-07-31T17:00:00+01:00,221118,GB-LND,,GBR
UPS Maintenance,19UK5624Q0047,"STATE, DEPARTMENT OF","STATE, DEPARTMENT OF",U.S. EMBASSY LONDON,53:04.9,Combined Synopsis/Solicitation,12/31/2024,,2024-07-25T17:00:00+01:00,221118,GB-LND,,GBR
"Design-Build Construct Multi-Purpose Facility, Larnaca, Cyprus",N3319124R0038,DEPT OF DEFENSE,DEPT OF THE NAVY,NAVFACSYSCOM EUROPE AFRICA CENTRAL,47:19.5,Solicitation,07-11-25,,2024-08-10T14:00:00+01:00,236210,CY-03,,CYP
"Custodial services at USAG-Italy Vicenza and Poggio Renatico (FE), Italy.",W912PF24DU004,DEPT OF DEFENSE,DEPT OF THE ARMY,0414 AQ HQ     CONTRACT AUG,26:15.6,Award Notice,12/31/2024,,,561720,,9630,ITA
"FY24 PROCUREMENT OF A TRAILER FOR NAVFAC FE, MISAWA",N4008424Q0011,DEPT OF DEFENSE,DEPT OF THE NAVY,NAVFACSYSCOM FAR EAST,30:24.2,Solicitation,7/23/2025,,2024-08-26T14:30:00+09:00,336212,,,JPN
Industry Day - Aviation Fuel Facility and SATOC for Small Construction projects in Soto Cano Honduras,W9127824R0077,DEPT OF DEFENSE,DEPT OF THE ARMY,US ARMY ENGINEER DISTRICT MOBILE,19:35.3,Special Notice,9/30/2025,,2024-07-04T17:00:00-05:00,236220,,,HND
Supply and Delivery of Fuel in September 2024,19RP3824Q0184,"STATE, DEPARTMENT OF","STATE, DEPARTMENT OF",U.S. EMBASSY MANILA,05:54.6,Presolicitation,4/22/2025,,2024-09-04T10:00:00-04:00,324191,,1300,PHL
To perform monthly maintenance of the audio-visual system for an office in the US Embassy Singapore.,19SN1024Q0032,"STATE, DEPARTMENT OF","STATE, DEPARTMENT OF",U.S. EMBASSY SINGAPORE,44:17.6,Solicitation,1/22/2025,,2024-08-16T16:30:00+08:00,334290,SG-01,258508,SGP
"Refurbishment of Rooms at Ground Floor, VA Building",19RP3824Q0156,"STATE, DEPARTMENT OF","STATE, DEPARTMENT OF",U.S. EMBASSY MANILA,56:12.9,Solicitation,1/31/2025,,2024-07-23T16:00:00+08:00,236220,,,PHL
"Proposed CDC Office Expansion, NOX 3",19RP3824Q0155,"STATE, DEPARTMENT OF","STATE, DEPARTMENT OF",U.S. EMBASSY MANILA,51:09.9,Solicitation,1/31/2025,,2024-08-02T16:00:00+08:00,236220,,,PHL
"Sources Sought Announcement for Indefinite-Delivery, Indefinite-Quantity (IDIQ) for General Architect and Engineering (A-E) Services in Italy for USACE Europe District (MILCON)",W912GB24R0053,DEPT OF DEFENSE,DEPT OF THE ARMY,W2SD FEST NAU1 EUROPE,58:47.6,Sources Sought,9/30/2027,,2024-08-02T13:00:00+02:00,541330,,,ITA
"Sources Sought Announcement for Indefinite-Delivery, Indefinite-Quantity (IDIQ) for General Architect and Engineering (A-E) Services in Italy for USACE Europe District (Other)",W912GB24R0054,DEPT OF DEFENSE,DEPT OF THE ARMY,W2SD FEST NAU1 EUROPE,53:02.8,Sources Sought,9/30/2027,,2024-08-02T13:00:00+02:00,541330,,,ITA
Pension Consulting Services,19UK5624Q0040,"STATE, DEPARTMENT OF","STATE, DEPARTMENT OF",U.S. EMBASSY LONDON,35:09.7,Solicitation,1/31/2025,,2024-08-02T17:00:00+01:00,541612,,,GBR
"Supply, Delivery and Installation of Mosquito Trap",19RP3824Q0181,"STATE, DEPARTMENT OF","STATE, DEPARTMENT OF",U.S. EMBASSY MANILA,57:35.2,Presolicitation,2/18/2025,,,561710,,,PHL
Supply and Delivery of Medical Supplies and Equipment,19RP3824Q0163,"STATE, DEPARTMENT OF","STATE, DEPARTMENT OF",U.S. EMBASSY MANILA,35:59.1,Solicitation,1/30/2025,,2024-08-01T15:00:00+08:00,339112,,,PHL
FY24 PROCUREMENT OF LGHG VEHICLES FOR NAVFAC FE,N4008424Q0012,DEPT OF DEFENSE,DEPT OF THE NAVY,NAVFACSYSCOM FAR EAST,14:07.8,Presolicitation,7/17/2025,,2024-09-03T14:30:00+09:00,336212,,,JPN
"ARCENT Readiness Training Center Microgrid Project - Camp Buehring, Kuwait",W912QR24R0046,DEPT OF DEFENSE,DEPT OF THE ARMY,W072 ENDIST LOUISVILLE,26:49.7,Solicitation,7/16/2025,,2024-08-05T10:00:00-04:00,237130,,,KWT
"ARCENT Readiness Training Center Microgrid Project - Camp Buehring, Kuwait",W912QR24R0046,DEPT OF DEFENSE,DEPT OF THE ARMY,W072 ENDIST LOUISVILLE,22:08.0,Solicitation,6/24/2025,,2024-08-05T10:00:00-04:00,237130,,,KWT
Supply and Installation of retractable awnings at American Embassy in Buenos Aires,19AR2024R0004,"STATE, DEPARTMENT OF","STATE, DEPARTMENT OF",U.S. EMBASSY BUENOS AIRES,13:25.9,Presolicitation,12/31/2024,,2024-07-30T23:00:00-03:00,541310,AR-C,1420,ARG
Supply and Delivery of Audio-Visual System for U.S. Embassy Manila,19RP3824Q0173,"STATE, DEPARTMENT OF","STATE, DEPARTMENT OF",U.S. EMBASSY MANILA,24:09.9,Solicitation,4/29/2025,,2024-07-31T14:00:00+08:00,334310,,,PHL
Preventive Maintenance for Fuel Distribution Systems,19AL6024Q0003,"STATE, DEPARTMENT OF","STATE, DEPARTMENT OF",U.S. EMBASSY TIRANA,22:29.3,Combined Synopsis/Solicitation,12/31/2024,,2024-07-31T17:00:00+02:00,811,AL-11,,ALB
Janitorial Services,19AR2024Q0006,"STATE, DEPARTMENT OF","STATE, DEPARTMENT OF",U.S. EMBASSY BUENOS AIRES,22:34.8,Solicitation,6/16/2025,,2024-09-16T12:00:00-03:00,561720,AR-C,C1425GMN,ARG
Supply and Delivery of Audio-Visual Equipment,19RP3824Q0162,"STATE, DEPARTMENT OF","STATE, DEPARTMENT OF",U.S. EMBASSY MANILA,46:41.7,Solicitation,4/26/2025,,2024-07-26T14:00:00+08:00,334310,,,PHL
Supply and Delivery of Audio and Video Equipment,19RP3824Q0164,"STATE, DEPARTMENT OF","STATE, DEPARTMENT OF",U.S. EMBASSY MANILA,24:26.3,Solicitation,1/30/2025,,2024-07-26T15:00:00+08:00,334310,,,PHL
"Refurbishment of Rooms at Ground Floor, VA Building",19RP3824Q0156,"STATE, DEPARTMENT OF","STATE, DEPARTMENT OF",U.S. EMBASSY MANILA,50:05.1,Solicitation,1/31/2025,,2024-07-23T16:00:00+08:00,236220,,,PHL
"Proposed CDC Office Expansion, NOX 3",19RP3824Q0155,"STATE, DEPARTMENT OF","STATE, DEPARTMENT OF",U.S. EMBASSY MANILA,28:03.3,Solicitation,1/31/2025,,2024-08-02T16:00:00+08:00,236220,,,PHL
INL Colombia Construction IDIQ,19AQMM24R0102,"STATE, DEPARTMENT OF","STATE, DEPARTMENT OF",ACQUISITIONS - AQM MOMENTUM,27:51.7,Solicitation,10-05-24,,2024-09-20T12:00:00-04:00,236220,,,COL
Pension Consulting Services,19UK5624Q0040,"STATE, DEPARTMENT OF","STATE, DEPARTMENT OF",U.S. EMBASSY LONDON,39:29.6,Solicitation,1/31/2025,,2024-07-19T17:00:00+01:00,541612,,,GBR
SUPPLY AND DELIVERY OF GSO/P&S- HOUSEHOLD APPLIANCES,19RP3824Q0175,"STATE, DEPARTMENT OF","STATE, DEPARTMENT OF",U.S. EMBASSY MANILA,00:08.2,Presolicitation,04-11-25,,,3352,PH-MAN,,PHL
"Temporary Quarters in BGC, Taguig City",19RP3824Q0137,"STATE, DEPARTMENT OF","STATE, DEPARTMENT OF",U.S. EMBASSY MANILA,54:54.2,Solicitation,12/30/2024,,2024-06-21T15:00:00+08:00,531110,,,PHL
AIR POUCH HANDLING SERVICES FOR INCOMING INTERNATIONAL DIPLOMATIC POUCH,19RP3824Q0176,"STATE, DEPARTMENT OF","STATE, DEPARTMENT OF",U.S. EMBASSY MANILA,45:30.1,Presolicitation,1/31/2025,,,488510,,,PHL
UPS Maintenance,19UK5624Q0047,"STATE, DEPARTMENT OF","STATE, DEPARTMENT OF",U.S. EMBASSY LONDON,00:26.0,Combined Synopsis/Solicitation,12/31/2024,,2024-07-25T17:00:00+01:00,221118,GB-LND,,GBR
UPS Maintenance,19UK5624Q0047,"STATE, DEPARTMENT OF","STATE, DEPARTMENT OF",U.S. EMBASSY LONDON,58:18.1,Combined Synopsis/Solicitation,12/31/2024,,2024-07-25T17:00:00+01:00,221118,GB-LND,,GBR
Tolterodine Tartrate ER 24HR Capsules,SPE2D223R0001,DEPT OF DEFENSE,DEFENSE LOGISTICS AGENCY,DLA TROOP SUPPORT,34:14.1,Award Notice,12-12-29,,,325412,IN-MH,421506,IND
Tolterodine Tartrate ER 24HR Capsules,SPE2D223R0001,DEPT OF DEFENSE,DEFENSE LOGISTICS AGENCY,DLA TROOP SUPPORT,29:19.5,Award Notice,12-12-29,,,325412,IN-MH,421506,IND
Supply and Delivery of Audio-Visual System for U.S. Embassy Manila,19RP3824Q0173,"STATE, DEPARTMENT OF","STATE, DEPARTMENT OF",U.S. EMBASSY MANILA,14:13.5,Presolicitation,04-10-25,,2024-07-25T10:00:00-04:00,334310,PH-MAK,1000,PHL
REPAIR WORKS AT 20B CAMERON ESSENSA TOWERS,19RP3824Q0141,"STATE, DEPARTMENT OF","STATE, DEPARTMENT OF",U.S. EMBASSY MANILA,00:07.8,Solicitation,03-01-25,,2024-07-25T16:00:00+08:00,236118,,,PHL
REPAIR WORKS AT 5B LAWTON ESSENSA TOWER,19RP3824Q0139,"STATE, DEPARTMENT OF","STATE, DEPARTMENT OF",U.S. EMBASSY MANILA,54:24.1,Solicitation,03-01-25,,2024-07-25T16:00:00+08:00,236118,,,PHL
REPAIR WORKS AT GF/B LAWTON ESSENSA TOWERS,19RP3824Q0138,"STATE, DEPARTMENT OF","STATE, DEPARTMENT OF",U.S. EMBASSY MANILA,48:35.9,Solicitation,03-01-25,,2024-07-25T16:00:00+08:00,236118,,,PHL
UPS Maintenance,19UK5624Q0047,"STATE, DEPARTMENT OF","STATE, DEPARTMENT OF",U.S. EMBASSY LONDON,15:50.8,Combined Synopsis/Solicitation,08-09-24,,2024-07-25T17:00:00+01:00,221118,GB-LND,,GBR
UPS Maintenance,19UK5624Q0047,"STATE, DEPARTMENT OF","STATE, DEPARTMENT OF",U.S. EMBASSY LONDON,15:50.8,Combined Synopsis/Solicitation,07-10-24,,2024-07-25T17:00:00+01:00,221118,GB-LND,,GBR
"N3319124R0009 D-B Floresti and Rezina Schools, Moldova",N3319124R0009,DEPT OF DEFENSE,DEPT OF THE NAVY,NAVFACSYSCOM EUROPE AFRICA CENTRAL,19:46.9,Solicitation,08-11-24,,2024-07-22T14:00:00+02:00,236220,,,MDA
19SG2024Q0025__GARDENING AND LANDSCAPING SERVICE FOR US EMBASSY DAKAR,19SG2024Q0025,"STATE, DEPARTMENT OF","STATE, DEPARTMENT OF",U.S. EMBASSY DAKAR,37:47.6,Solicitation,12/31/2024,,2024-07-09T00:00:00-04:00,561730,,,SEN
DELIVERY AND INSTALLATION OF HVAC UNITS FOR USAGM,19RP3824Q0136,"STATE, DEPARTMENT OF","STATE, DEPARTMENT OF",U.S. EMBASSY MANILA,49:10.3,Presolicitation,2/28/2025,,,238220,,,PHL
"RENOVATION OF PROPOSED MRSS OFFICE, GPS BUILDING",19RP3824Q0126,"STATE, DEPARTMENT OF","STATE, DEPARTMENT OF",U.S. EMBASSY MANILA,35:25.3,Solicitation,12/31/2024,,2024-07-09T16:00:00+08:00,236220,,,PHL
DELIVERY AND INSTALLATION OF HVAC UNITS FOR USAGM,19RP3824Q0136,"STATE, DEPARTMENT OF","STATE, DEPARTMENT OF",U.S. EMBASSY MANILA,25:44.1,Presolicitation,2/28/2025,,,238220,,,PHL
"Tegucigalpa, Honduras - Janitorial Services for the New Embassy Compound",19H08023Q0027,"STATE, DEPARTMENT OF","STATE, DEPARTMENT OF",U.S. EMBASSY VALLETTA,18:38.5,Solicitation,12/31/2024,,2023-12-13T10:00:00-06:00,561720,HN-FM,,HND
"ARCENT Readiness Training Center Microgrid Project - Camp Buehring, Kuwait",W912QR24R0046,DEPT OF DEFENSE,DEPT OF THE ARMY,W072 ENDIST LOUISVILLE,34:26.6,Solicitation,6/24/2025,,2024-07-17T13:00:00-04:00,237130,,,KWT
REPAIR WORKS AT 2A NORTH PPT,19RP3824Q0124,"STATE, DEPARTMENT OF","STATE, DEPARTMENT OF",U.S. EMBASSY MANILA,34:11.1,Solicitation,1/31/2025,,2024-07-19T04:00:00+08:00,236118,,,PHL
REPAIR WORKS AT 2C SOUTH PPT,19RP3824Q0123,"STATE, DEPARTMENT OF","STATE, DEPARTMENT OF",U.S. EMBASSY MANILA,28:29.5,Solicitation,1/31/2025,,2024-07-19T16:00:00+08:00,236118,,,PHL
19SG2024Q0009 - Dakar - Garbage and Trash Collection Services,19SG2024Q0009,"STATE, DEPARTMENT OF","STATE, DEPARTMENT OF",U.S. EMBASSY DAKAR,13:07.9,Special Notice,12/31/2025,,2024-07-15T12:00:00+02:00,562111,SN-DK,,SEN
"CY24 WTOGPA Notice, Kapaun AS, Germany",FA5613WTOGPA,DEPT OF DEFENSE,DEPT OF THE AIR FORCE,FA5613  700 CONS PK,44:07.8,Special Notice,1/14/2025,,2024-12-30T15:00:00+01:00,,DE-RP,,DEU
"CY24 WTOGPA Notice, Kapaun AS, Germany",FA5613WTOGPA,DEPT OF DEFENSE,DEPT OF THE AIR FORCE,FA5613  700 CONS PK,35:44.0,Special Notice,1/14/2025,,2024-12-30T15:00:00+01:00,,DE-RP,,DEU
SUPPLY AND DELIVERY OF AUDIO AND VIDEO EQUIPMENTS,19RP3824Q0164,"STATE, DEPARTMENT OF","STATE, DEPARTMENT OF",U.S. EMBASSY MANILA,06:21.9,Presolicitation,1/30/2025,,,334310,,,PHL
SUPPLY AND DELIVERY OF MEDICAL SUPPLIES AND EQUIPMENTS,19RP3824Q0163,"STATE, DEPARTMENT OF","STATE, DEPARTMENT OF",U.S. EMBASSY MANILA,02:44.3,Presolicitation,1/30/2025,,,339112,,,PHL
"AMENDMENT 0007 - P9837 AMBULATORY CARE CENTER, NAVAL STATION GUANTANAMO BAY, CUBA",N6945024R0005-0007,DEPT OF DEFENSE,DEPT OF THE NAVY,NAVFACSYSCOM SOUTHEAST,03:08.6,Solicitation,12/31/2024,,2024-07-25T14:00:00-04:00,236220,N/A,,AX2
PREVENTIVE MAINTENANCE OF FOUR DIESEL GENERATORS,19UK5624Q0039,"STATE, DEPARTMENT OF","STATE, DEPARTMENT OF",U.S. EMBASSY LONDON,01:59.4,Solicitation,12/31/2024,,2024-07-17T17:00:00+01:00,221112,,,GBR
Pituffik Space Base Sealift,FA2523-24-R-0002,DEPT OF DEFENSE,DEPT OF THE AIR FORCE,"FA2523  DETACHMENT 1, 21 CONS",48:35.7,Presolicitation,9/30/2024,,2024-07-19T16:00:00+02:00,483111,,,GRL
C-130 Maintenance & Repair Services,N6264924R0029,DEPT OF DEFENSE,DEPT OF THE NAVY,NAVSUP FLT LOG CTR  YOKOSUKA,47:08.2,Presolicitation,08-01-25,,2024-08-01T16:00:00+09:00,488190,,,JPN
SUPPLY AND DELIVERY OF EXPLOSIVE TRACE DETECTOR (ETD),19RP3824Q0170,"STATE, DEPARTMENT OF","STATE, DEPARTMENT OF",U.S. EMBASSY MANILA,29:21.5,Presolicitation,3/31/2025,,,334511,,,PHL
"Maintenance and Repair of Fire Alarm, Fire Detection Systems and Emergency Lights for USAG – Italy, Livorno",W912PF24Q0092,DEPT OF DEFENSE,DEPT OF THE ARMY,0414 AQ HQ     CONTRACT AUG,32:10.5,Combined Synopsis/Solicitation,6/27/2025,,2024-07-05T09:00:00+02:00,922160,IT-LI,,ITA
SUPPLY AND DELIVERY OF AUDIO AND VIDEO EQUIPMENTS,19RP3824Q0164,"STATE, DEPARTMENT OF","STATE, DEPARTMENT OF",U.S. EMBASSY MANILA,52:42.0,Presolicitation,1/30/2025,,,334310,,,PHL
SUPPLY AND DELIVERY OF MEDICAL SUPPLIES AND EQUIPMENTS,19RP3824Q0163,"STATE, DEPARTMENT OF","STATE, DEPARTMENT OF",U.S. EMBASSY MANILA,51:05.8,Presolicitation,1/30/2025,,,339112,,,PHL
Work Injury Compensation Insurance for US Embassy Singapore,19SN1024Q0023,"STATE, DEPARTMENT OF","STATE, DEPARTMENT OF",U.S. EMBASSY SINGAPORE,47:16.4,Solicitation,12/31/2024,,2024-07-29T16:30:00+08:00,524210,,,SGP
To perform monthly maintenance of the audio-visual system for an office in the US Embassy Singapore.,19SN1024Q0032,"STATE, DEPARTMENT OF","STATE, DEPARTMENT OF",U.S. EMBASSY SINGAPORE,46:50.4,Presolicitation,12/28/2024,,2024-08-14T16:30:00+08:00,334290,SG-01,258508,SGP
Industry Day - Aviation Fuel Facility and SATOC for Small Construction projects in Soto Cano Honduras,W9127824R0077,DEPT OF DEFENSE,DEPT OF THE ARMY,US ARMY ENGINEER DISTRICT MOBILE,00:02.4,Special Notice,9/30/2025,,2024-07-04T17:00:00-05:00,236220,,,HND
"RENOVATION OF PROPOSED MRSS OFFICE, GPS BUILDING",19RP3824Q0126,"STATE, DEPARTMENT OF","STATE, DEPARTMENT OF",U.S. EMBASSY MANILA,01:21.8,Solicitation,12/31/2024,,2024-07-09T16:00:00+08:00,236220,,,PHL
REPAIR WORKS AT 20B CAMERON ESSENSA TOWERS,19RP3824Q0141,"STATE, DEPARTMENT OF","STATE, DEPARTMENT OF",U.S. EMBASSY MANILA,48:11.9,Solicitation,03-01-25,,2024-07-25T16:00:00+08:00,236118,,,PHL
SUPPLY AND DELIVERY OF DT AV EQUIPMENT FOR ARC,19RP3824Q0145,"STATE, DEPARTMENT OF","STATE, DEPARTMENT OF",U.S. EMBASSY MANILA,39:28.0,Solicitation,04-05-25,,2024-07-05T15:00:00+08:00,334310,,,PHL
Landscaping and Gardening Maintenance Services,19EK2024Q0002,"STATE, DEPARTMENT OF","STATE, DEPARTMENT OF",U.S. EMBASSY MALABO,50:22.9,Presolicitation,03-01-25,,2024-07-11T17:00:00-04:00,561730,GQ-BN,,GNQ
REPAIR WORKS AT 2A NORTH PPT,19RP3824Q0124,"STATE, DEPARTMENT OF","STATE, DEPARTMENT OF",U.S. EMBASSY MANILA,03:46.9,Solicitation,1/31/2025,,2024-07-12T04:00:00+08:00,236118,,,PHL
REPAIR WORKS AT 2C SOUTH PPT,19RP3824Q0123,"STATE, DEPARTMENT OF","STATE, DEPARTMENT OF",U.S. EMBASSY MANILA,01:46.0,Solicitation,1/31/2025,,2024-07-12T16:00:00+08:00,236118,,,PHL
Dry Cleaning and Decontamination of Draperies and Related Services,19RP3824Q0157,"STATE, DEPARTMENT OF","STATE, DEPARTMENT OF",U.S. EMBASSY MANILA,57:35.8,Solicitation,12/30/2024,,2024-07-11T16:00:00+08:00,812320,PH-MAN,,PHL
REPAIR WORKS AT GF/B LAWTON ESSENSA TOWERS,19RP3824Q0138,"STATE, DEPARTMENT OF","STATE, DEPARTMENT OF",U.S. EMBASSY MANILA,55:41.2,Solicitation,03-01-25,,2024-07-25T16:00:00+08:00,236118,,,PHL
REPAIR WORKS AT 5B LAWTON ESSENSA TOWER,19RP3824Q0139,"STATE, DEPARTMENT OF","STATE, DEPARTMENT OF",U.S. EMBASSY MANILA,54:43.2,Solicitation,03-01-25,,2024-07-25T16:00:00+08:00,236118,,,PHL
REPAIR WORKS AT 20B CAMERON ESSENSA TOWERS,19RP3824Q0141,"STATE, DEPARTMENT OF","STATE, DEPARTMENT OF",U.S. EMBASSY MANILA,54:07.6,Solicitation,03-01-25,,2024-07-01T16:00:00+08:00,236118,,,PHL
"RFQ PR12579742: Conflict Resolution, Negotiation & Mediation Training.",PR12579742,"STATE, DEPARTMENT OF","STATE, DEPARTMENT OF",U.S. EMBASSY DAR ES SALAAM,11:20.6,Solicitation,12/31/2024,,2024-07-05T11:00:00+03:00,611430,,,TZA
Supply and Delivery of Audio-Visual Equipment,19RP3824Q0162,"STATE, DEPARTMENT OF","STATE, DEPARTMENT OF",U.S. EMBASSY MANILA,30:07.6,Presolicitation,3/22/2025,,,334310,,,PHL
SUPPLY AND DELIVERY OF WASHER AND DRYER,19RP3824Q0153,"STATE, DEPARTMENT OF","STATE, DEPARTMENT OF",U.S. EMBASSY MANILA,28:24.8,Solicitation,1/22/2025,,2024-07-09T15:00:00+08:00,335220,,,PHL
"FY24 PROCUREMENT OF A TRAILER FOR NAVFAC FE, MISAWA",N4008424Q0011,DEPT OF DEFENSE,DEPT OF THE NAVY,NAVFACSYSCOM FAR EAST,34:16.3,Presolicitation,6/25/2025,,2024-08-19T14:30:00+09:00,336212,,,JPN
Supply and Installation of Inverter Split type AC Units,19RP3824Q0119,"STATE, DEPARTMENT OF","STATE, DEPARTMENT OF",U.S. EMBASSY MANILA,50:12.1,Solicitation,12/30/2024,,2024-07-05T16:00:00+08:00,423620,,,PHL
Italy Electricity Supply for U.S. Navy,N3319124R0025,DEPT OF DEFENSE,DEPT OF THE NAVY,NAVFACSYSCOM EUROPE AFRICA CENTRAL,41:05.6,Solicitation,6/24/2025,,2024-06-25T14:00:00+02:00,221122,,,ITA
"ARCENT Readiness Training Center Microgrid Project - Camp Buehring, Kuwait",W912QR24R0046,DEPT OF DEFENSE,DEPT OF THE ARMY,W072 ENDIST LOUISVILLE,34:30.3,Solicitation,6/24/2025,,2024-07-08T13:00:00-04:00,237130,,,KWT
"ARCENT Readiness Training Center Microgrid Project - Camp Buehring, Kuwait",W912QR24R0046,DEPT OF DEFENSE,DEPT OF THE ARMY,W072 ENDIST LOUISVILLE,23:58.1,Solicitation,5/20/2025,,2024-07-08T13:00:00-04:00,237130,,,KWT
Italy Electricity Supply for U.S. Navy,N3319124R0025,DEPT OF DEFENSE,DEPT OF THE NAVY,NAVFACSYSCOM EUROPE AFRICA CENTRAL,59:30.5,Solicitation,6/24/2025,,2024-06-25T14:00:00+00:00,221122,,,ITA
"RENOVATION OF PROPOSED MRSS OFFICE, GPS BUILDING",19RP3824Q0126,"STATE, DEPARTMENT OF","STATE, DEPARTMENT OF",U.S. EMBASSY MANILA,21:52.8,Solicitation,12/31/2024,,2024-07-09T16:00:00+08:00,236220,,,PHL
"Custodial services at USAG-Italy Vicenza and Poggio Renatico (FE), Italy.",W912PF24Q0047,DEPT OF DEFENSE,DEPT OF THE ARMY,0414 AQ HQ     CONTRACT AUG,23:23.8,Solicitation,06-11-25,,2024-06-28T11:00:00+02:00,561720,,9630,ITA
"Maintenance and Repair of Fire Alarm, Fire Detection Systems and Emergency Lights for USAG – Italy, Livorno",W912PF24Q0092,DEPT OF DEFENSE,DEPT OF THE ARMY,0414 AQ HQ     CONTRACT AUG,07:37.4,Combined Synopsis/Solicitation,6/27/2025,,2024-06-27T11:00:00+02:00,922160,IT-LI,,ITA
SUPPLY AND DELIVERY OF DT AV EQUIPMENT FOR ARC,19RP3824Q0145,"STATE, DEPARTMENT OF","STATE, DEPARTMENT OF",U.S. EMBASSY MANILA,12:46.0,Solicitation,04-05-25,,2024-07-05T15:00:00+08:00,334310,,,PHL
Supply and Delivery of Air Purifier,19RP3824Q0150,"STATE, DEPARTMENT OF","STATE, DEPARTMENT OF",U.S. EMBASSY MANILA,12:02.8,Solicitation,1/17/2025,,2024-07-05T15:00:00+08:00,333413,,,PHL
Supply and Delivery of Kitchen Appliances,19RP3824Q0148,"STATE, DEPARTMENT OF","STATE, DEPARTMENT OF",U.S. EMBASSY MANILA,06:40.8,Solicitation,1/17/2025,,2024-07-05T15:00:00+08:00,337126,,,PHL
"Custodial services at USAG-Italy Vicenza and Poggio Renatico (FE), Italy.",W912PF24Q0047,DEPT OF DEFENSE,DEPT OF THE ARMY,0414 AQ HQ     CONTRACT AUG,37:33.8,Solicitation,06-11-25,,2024-06-28T11:00:00+02:00,561720,,9630,ITA
PREVENTIVE MAINTENANCE OF FOUR DIESEL GENERATORS,19UK5624Q0039,"STATE, DEPARTMENT OF","STATE, DEPARTMENT OF",U.S. EMBASSY LONDON,05:17.2,Solicitation,09-01-24,,2024-07-12T17:00:00+01:00,221112,,,GBR
PREVENTIVE MAINTENANCE OF FOUR DIESEL GENERATORS,19UK5624Q0039,"STATE, DEPARTMENT OF","STATE, DEPARTMENT OF",U.S. EMBASSY LONDON,05:17.2,Solicitation,07-01-24,,2024-07-12T17:00:00+01:00,221112,,,GBR
"ARCENT Readiness Training Center Microgrid Project - Camp Buehring, Kuwait",W912QR24R0046,DEPT OF DEFENSE,DEPT OF THE ARMY,W072 ENDIST LOUISVILLE,59:48.9,Solicitation,5/20/2025,,2024-07-01T01:00:00-04:00,237130,,,KWT
Supply and Installation of Fire Detection and Alarm System for Two (2) USG Residences,19RP3824Q0095,"STATE, DEPARTMENT OF","STATE, DEPARTMENT OF",U.S. EMBASSY MANILA,09:51.0,Solicitation,1/22/2025,,2024-05-03T15:00:00+08:00,238210,PH-00,,PHL
"RENOVATION OF PROPOSED MRSS OFFICE, GPS BUILDING",19RP3824Q0126,"STATE, DEPARTMENT OF","STATE, DEPARTMENT OF",U.S. EMBASSY MANILA,49:26.2,Solicitation,12/31/2024,,2024-07-09T16:00:00+08:00,236220,,,PHL
Kaiserslautern Installation Support Services (KISS),FA5613KISS-IW,DEPT OF DEFENSE,DEPT OF THE AIR FORCE,FA5613  700 CONS PK,50:03.9,Special Notice,12/31/2024,,2024-04-24T16:00:00+02:00,561210,DE-RP,,DEU
Kaiserslautern Installation Support Services (KISS),FA5613KISS-IW,DEPT OF DEFENSE,DEPT OF THE AIR FORCE,FA5613  700 CONS PK,39:57.3,Special Notice,12/31/2024,,2024-04-24T16:00:00+02:00,561210,DE-RP,,DEU
"Custodial services at USAG-Italy Vicenza and Poggio Renatico (FE), Italy.",W912PF24Q0047,DEPT OF DEFENSE,DEPT OF THE ARMY,0414 AQ HQ     CONTRACT AUG,19:20.2,Solicitation,06-11-25,,2024-06-21T11:00:00+02:00,561720,,9630,ITA
Testing and Inspection of Fire Suppression Systems for USAG-Italy Vicenza and Poggio Renatico (FE),W912PF24Q0080,DEPT OF DEFENSE,DEPT OF THE ARMY,0414 AQ HQ     CONTRACT AUG,59:51.9,Combined Synopsis/Solicitation,6/28/2025,,2024-06-28T10:00:00+02:00,541380,IT-VI,9630,ITA
"AMENDMENT 0006 - P9837 AMBULATORY CARE CENTER, NAVAL STATION GUANTANAMO BAY, CUBA",N6945024R0005-0006,DEPT OF DEFENSE,DEPT OF THE NAVY,NAVFACSYSCOM SOUTHEAST,59:35.5,Solicitation,12/31/2024,,2024-07-25T14:00:00-04:00,236220,N/A,,AX2
"Temporary Quarters in BGC, Taguig City",19RP3824Q0137,"STATE, DEPARTMENT OF","STATE, DEPARTMENT OF",U.S. EMBASSY MANILA,01:12.5,Solicitation,12/30/2024,,2024-06-21T15:00:00+08:00,531110,,,PHL
Supply and Installation of Inverter Split type AC Units,19RP3824Q0119,"STATE, DEPARTMENT OF","STATE, DEPARTMENT OF",U.S. EMBASSY MANILA,59:05.1,Solicitation,12/30/2024,,2024-06-25T12:00:00+08:00,423620,,,PHL
"FY23 OMA Convert Vehicle Storage Warehouse B122-S1, Sagami General Depot",W912HV24B0012,DEPT OF DEFENSE,DEPT OF THE ARMY,W2SN ENDIST JAPAN,57:15.0,Solicitation,6/14/2025,,2024-08-22T14:00:00+09:00,236220,,,JPN
"FY23 OMA Convert Vehicle Storage Warehouse B122-S1, Sagami General Depot",W912HV24B0012,DEPT OF DEFENSE,DEPT OF THE ARMY,W2SN ENDIST JAPAN,53:15.9,Solicitation,6/14/2025,,2024-08-22T14:00:00+09:00,236220,,,JPN
INL Colombia Construction IDIQ,19AQMM24R0102,"STATE, DEPARTMENT OF","STATE, DEPARTMENT OF",ACQUISITIONS - AQM MOMENTUM,25:15.5,Solicitation,8/31/2024,,2024-08-16T12:00:00-04:00,236220,,,COL
Italy Electricity Supply for U.S. Navy,N3319124R0025,DEPT OF DEFENSE,DEPT OF THE NAVY,NAVFACSYSCOM EUROPE AFRICA CENTRAL,03:21.0,Solicitation,6/13/2025,,2024-06-24T14:00:00+02:00,221122,,,ITA
Private Sector Collaboration Pathway (PSCP) Annual Program Statement (APS) - USAID/Egypt Addendum,72026324APS00001,AGENCY FOR INTERNATIONAL DEVELOPMENT,AGENCY FOR INTERNATIONAL DEVELOPMENT,USAID/EGYPT,19:17.1,Special Notice,5/27/2025,,2025-05-12T23:59:00+03:00,,EG-C,4234122,EGY
19SG2024Q0025__GARDENING AND LANDSCAPING SERVICE FOR US EMBASSY DAKAR,19SG2024Q0025,"STATE, DEPARTMENT OF","STATE, DEPARTMENT OF",U.S. EMBASSY DAKAR,51:20.8,Solicitation,12/31/2024,,2024-07-09T00:00:00-04:00,561730,,,SEN
REPAIR WORKS AT 2A NORTH PPT,19RP3824Q0124,"STATE, DEPARTMENT OF","STATE, DEPARTMENT OF",U.S. EMBASSY MANILA,51:47.8,Solicitation,1/31/2025,,2024-07-12T04:00:00+08:00,236118,,,PHL
REPAIR WORKS AT 2C SOUTH PPT,19RP3824Q0123,"STATE, DEPARTMENT OF","STATE, DEPARTMENT OF",U.S. EMBASSY MANILA,51:10.3,Solicitation,1/31/2025,,2024-07-12T16:00:00+08:00,236118,,,PHL
"FY23 OMA Convert Vehicle Storage Warehouse B122-S1, Sagami General Depot",W912HV24B0012,DEPT OF DEFENSE,DEPT OF THE ARMY,W2SN ENDIST JAPAN,46:30.4,Solicitation,5/23/2025,,2024-08-22T14:00:00+09:00,236220,,,JPN
"Custodial services at USAG-Italy Vicenza and Poggio Renatico (FE), Italy.",W912PF24Q0047,DEPT OF DEFENSE,DEPT OF THE ARMY,0414 AQ HQ     CONTRACT AUG,48:43.1,Solicitation,06-11-25,,2024-06-21T11:00:00+02:00,561720,,9630,ITA
Real Estate - Karachi,19AQMM24R0177,"STATE, DEPARTMENT OF","STATE, DEPARTMENT OF",ACQUISITIONS - AQM MOMENTUM,58:41.8,Sources Sought,12/31/2024,SBP,2025-07-05T17:00:00-04:00,531210,,,PAK
"Questions and Answers Health Insurance Services for U.S. Embassy Asuncion, Paraguay",QandA_19PA1024R0001,"STATE, DEPARTMENT OF","STATE, DEPARTMENT OF",U.S. EMBASSY ASUNCION,58:55.3,Special Notice,1/31/2025,,,524114,PY-ASU,,PRY
"Pre Proposal Conference - Meeting Minutes - Health Insurance Services for U.S. Embassy Asuncion, Paraguay",19PA1024R0001,"STATE, DEPARTMENT OF","STATE, DEPARTMENT OF",U.S. EMBASSY ASUNCION,56:43.8,Special Notice,1/31/2025,,,524114,PY-ASU,,PRY
Pension Consulting Services,19UK5624Q0040,"STATE, DEPARTMENT OF","STATE, DEPARTMENT OF",U.S. EMBASSY LONDON,02:53.9,Solicitation,1/31/2025,,2024-07-19T17:00:00+01:00,541612,,,GBR
