Title,Sol#,Department/Ind.Agency,Sub-Tier,Office,PostedDate,Type,ArchiveDate,SetASideCode,ResponseDeadLine,NaicsCode,PopState,PopZip,PopCountry
DECAFY2025WTO,,DEPT OF DEFENSE,DEFENSE COMMISSARY AGENCY  (DECA),DEFENSE COMMISSARY AGENCY- EUR AREA,02:56.1,Special Notice,12/22/2024,LAS,2024-12-04T14:29:00+01:00,,DE-RP,,DEU
INL Kingston: Intelligence and Investigative Analytical Software for MOCA,191NLE25Q0013,"STATE, DEPARTMENT OF","STATE, DEPARTMENT OF",ACQUISITIONS - INL,55:55.7,Combined Synopsis/Solicitation,12/24/2024,,2024-12-09T09:00:00-05:00,513210,,,JAM
"Health Insurance for Locally Employed Staff at U.S. Embassy Georgetown, Guyana",19GE5025R0003,"STATE, DEPARTMENT OF","STATE, DEPARTMENT OF",ACQUISITIONS - RPSO FRANKFURT,36:59.4,Solicitation,1/14/2025,,2025-01-13T14:00:00+01:00,524114,,,GUY
Night Vision Devices for Foreign Military Sales (FMS),W91CRB25R50008,DEPT OF DEFENSE,DEPT OF THE ARMY,W6QK ACC-APG,22:54.8,Presolicitation,01-03-25,SBA,2024-12-19T10:00:00-05:00,333310,,,ALB
Preventative Maintenance for Transformers,PR12915581,"STATE, DEPARTMENT OF","STATE, DEPARTMENT OF",U.S. EMBASSY NASSAU,21:45.8,Solicitation,1/25/2025,,2025-01-10T17:00:00-05:00,561210,,,BHS
"Construction Site Security Manager - Aviano Air Base, Italy",FA568225Q8002,DEPT OF DEFENSE,DEPT OF THE AIR FORCE,FA5682  31 CONS DA LGC,18:15.2,Sources Sought,12/28/2024,,2024-12-13T15:00:00+01:00,561612,IT-PN,,ITA
"Maintenance of Family Housing Quarters, USAG Ansbach, Germany",W912PB25BA002,DEPT OF DEFENSE,DEPT OF THE ARMY,0409 AQ HQ     CONTRACT,16:56.1,Solicitation,1/24/2025,,2025-01-09T14:00:00+01:00,238330,,91522,DEU
"SINGLE SOURCE JUSTIFICATION UNDER THE SIMPLIFIED ACQUISITION THRESHOLD (SAT) PURSUANT TO FAR 13.106-l(b)(l), Air conditioning",19LG7525P0083,"STATE, DEPARTMENT OF","STATE, DEPARTMENT OF",U.S. EMBASSY RIGA,11:20.5,Justification,01-03-25,,,333415,,LV-1510,LVA
"Janitorial Services, Pre-solicitation notice",19LG7525Q0001,"STATE, DEPARTMENT OF","STATE, DEPARTMENT OF",U.S. EMBASSY RIGA,11:00.7,Presolicitation,04-01-25,,,561720,,LV-1510,LVA
"SINGLE SOURCE JUSTIFICATION UNDER THE SIMPLIFIED ACQUISITION THRESHOLD (SAT} PURSUANT TO FAR 13.106-l(b}(l}, air conditioning",19LG7525P0106,"STATE, DEPARTMENT OF","STATE, DEPARTMENT OF",U.S. EMBASSY RIGA,09:37.5,Justification,01-03-25,,,238220,,LV-1510,LVA
Preventative Maintenance for Boilers and EWH,PR12915523,"STATE, DEPARTMENT OF","STATE, DEPARTMENT OF",U.S. EMBASSY NASSAU,47:06.8,Solicitation,1/25/2025,,2025-01-10T17:00:00-05:00,561210,,,BHS
Request for Proposal: U.S. Embassy Muscat 2025 National Day Celebration Event,PR15023063,"STATE, DEPARTMENT OF","STATE, DEPARTMENT OF",U.S. EMBASSY MUSCAT,43:51.7,Combined Synopsis/Solicitation,01-06-25,,2024-12-22T14:00:00+04:00,711310,,,OMN
M/SCAT Maintenance and Sustainment Services,W912PB-25-R-4004,DEPT OF DEFENSE,DEPT OF THE ARMY,0409 AQ HQ     CONTRACT,25:58.0,Solicitation,12/28/2024,,2024-12-13T15:00:00+01:00,811191,,,POL
"Mobile Phone Services U.S. Embassy Copenhagen, Denmark",19DA2025Q0001,"STATE, DEPARTMENT OF","STATE, DEPARTMENT OF",U.S. EMBASSY COPENHAGEN,07:59.3,Solicitation,1/25/2025,,2025-01-10T12:00:00+01:00,517112,DK-84,2100,DNK
Building Automation System (BAS) Upgrade services,PR15018256,"STATE, DEPARTMENT OF","STATE, DEPARTMENT OF",U.S. EMBASSY BERLIN,42:20.1,Solicitation,01-10-25,,2025-01-10T17:00:00+01:00,3399,DE-BE,14195,DEU
"Supply and installation of Glass material Rome, Italy",191T7025Q0003,"STATE, DEPARTMENT OF","STATE, DEPARTMENT OF",U.S. EMBASSY ROME,51:21.2,Presolicitation,12-04-25,,,238150,IT-RM,187,ITA
"IMPROVE BACKWASH OPERATIONS FOR INDOOR SWIMMING POOL AT CFA CHINHAE, KOREA",N40084-25-Q-4004,DEPT OF DEFENSE,DEPT OF THE NAVY,NAVFACSYSCOM FAR EAST,48:26.5,Solicitation,12/31/2024,,2024-12-16T14:00:00+09:00,238990,KR-48,,KOR
Between Occupancy Maintenance (BOM) of Military Family Housing (OCONUS),W912CM25R0001,DEPT OF DEFENSE,DEPT OF THE ARMY,0409 AQ HQ     CONTRACT =,29:12.7,Presolicitation,12/31/2024,,2024-12-16T12:00:00+01:00,,,,DEU
Looking for Microsoft Dataverse & Power Apps Subject Matter Expert,FA568225Q2002,DEPT OF DEFENSE,DEPT OF THE AIR FORCE,FA5606  52 CONS DA LGC,58:26.5,Sources Sought,12/24/2024,,2024-12-09T15:00:00-05:00,541511,IT-PN,,ITA
USS LEWIS B. PULLER (ESB-3) FY25 Voyage Repair,N6817125R0003,DEPT OF DEFENSE,DEPT OF THE NAVY,NAVSUP FLC SIGONELLA NAPLES OFFICE,36:24.4,Presolicitation,01-01-25,,2024-12-17T10:00:00+01:00,336611,,,ITA
Risner Group Fitness,FA527025SS0002,DEPT OF DEFENSE,DEPT OF THE AIR FORCE,FA5270  18 CONS PK,21:08.5,Sources Sought,12/31/2024,,2024-12-16T11:00:00+09:00,812990,JP-47,96367,JPN
"Solid Waste Management Service, USAG-Humphreys",W91QVN25R0010,DEPT OF DEFENSE,DEPT OF THE ARMY,0411 AQ HQ     CONTRACT AUG,02:08.1,Combined Synopsis/Solicitation,9/30/2025,,2024-12-06T13:00:00+09:00,562111,KR-41,,KOR
"Preventive Maintenance and Repair for Vertical Transportation Equipment (VTE) Systems in the U.S. Commander Fleet Activities Yokosuka (CFAY), Kanto Plain Area Japan",N4008425B0401,DEPT OF DEFENSE,DEPT OF THE NAVY,NAVFACSYSCOM FAR EAST,49:03.1,Solicitation,02-01-25,,2025-01-17T10:30:00+09:00,333921,JP-14,,JPN
Furniture Moving Services,W91QVN25R0001,DEPT OF DEFENSE,DEPT OF THE ARMY,0906 AQ CO     CONTRACTING BAT,41:08.6,Sources Sought,12/28/2024,,2024-12-13T10:00:00+09:00,484210,,,KOR
"Conversion of Building to Secure Space, Okinawa, Japan",W912HV25R0002,DEPT OF DEFENSE,DEPT OF THE ARMY,W2SN ENDIST JAPAN,00:17.6,Presolicitation,12/30/2024,,2025-11-01T17:00:00-04:00,236220,JP-47,,JPN
Movement of Government Furniture and Appliances at Naval Air Facility (NAF) Atsugi,FA520924Q0060,DEPT OF DEFENSE,DEPT OF THE AIR FORCE,FA5209  374 CONS PK,12:54.0,Solicitation,12/27/2024,,2024-12-12T14:00:00+09:00,484210,JP-14,,JPN
"19AQMM25R0023 Pre-Solicitation Notice for US Kampala, Uganda Controlled Area Access (CAA) Renovation & Expansion",19AQMM25R0023,"STATE, DEPARTMENT OF","STATE, DEPARTMENT OF",ACQUISITIONS - AQM MOMENTUM,33:53.2,Presolicitation,01-01-25,,2024-12-17T15:00:00-05:00,236220,,,UGA
INL Kingston Open-Source Intelligence (OSINT) Software,191NLE25Q0023,"STATE, DEPARTMENT OF","STATE, DEPARTMENT OF",ACQUISITIONS - INL,22:41.5,Combined Synopsis/Solicitation,12/31/2024,SBA,2024-12-16T09:00:00-05:00,513210,,,JAM
"Corrected: U.S. Department of Agriculture Seeks to Lease Office and Related Space in Mercer, Mercer County, PA",57-42085-25-FA,"AGRICULTURE, DEPARTMENT OF",FARM PRODUCTION AND CONSERVATION BUSINESS CENTER,FPAC BUS CNTR-MGMT SVS DIV,35:51.3,Presolicitation,12-11-24,,2024-12-10T16:30:00-05:00,531120,,,ARE
"Renovation of Building 99 at Pituffik Space Base, Greenland",W912DS25R0002,DEPT OF DEFENSE,DEPT OF THE ARMY,W2SD ENDIST NEW YORK,08:10.6,Presolicitation,12/25/2024,,2024-12-10T16:00:00-05:00,236220,,,GRL
"Renovation of Building 99 at Pituffik Space Base, Greenland",W912DS25R0002,DEPT OF DEFENSE,DEPT OF THE ARMY,W2SD ENDIST NEW YORK,06:32.2,Presolicitation,12/21/2024,,2024-12-06T16:00:00-05:00,236220,,,GRL
Purchase of 2 Multi-Functional Devices,SP7000-25-RFI-1009,DEPT OF DEFENSE,DEFENSE LOGISTICS AGENCY,DCSO-P NEW CUMBERLAND,32:50.8,Sources Sought,12/27/2024,,2024-12-12T10:00:00-05:00,532420,,,KOR
NATO Business Opportunity: Information Environment Assessment Capability (IEAC) Data Service,IFB-424209-IEAC,"COMMERCE, DEPARTMENT OF",BUREAU OF INDUSTRY AND SECURITY,BUREAU OF INDUSTRY AND SECURITY,06:03.0,Special Notice,1/16/2025,,2025-01-13T17:00:00-05:00,541519,,,BEL
Travel Management Services,19BH2025Q0003,"STATE, DEPARTMENT OF","STATE, DEPARTMENT OF",U.S.EMBASSY BELMOPAN,25:26.3,Combined Synopsis/Solicitation,6/13/2025,,2024-12-13T11:00:00-06:00,561510,BZ-CY,,BLZ
Pre-Solicitation for Remodeling of 55 Kabulonga from residential to Employee Recreation (AMCA) Facility- U.S Embassy Lusaka,19ZA6024Q0003,"STATE, DEPARTMENT OF","STATE, DEPARTMENT OF",U.S. EMBASSY LUSAKA,46:40.0,Presolicitation,01-01-25,,2024-12-19T12:00:00+00:00,236220,ZM-02,,ZMB
DAGR Accessories for United Arab Emirates (Rev),W91CRB25Q5002-R,DEPT OF DEFENSE,DEPT OF THE ARMY,W6QK ACC-APG,26:20.0,Combined Synopsis/Solicitation,1/23/2025,SBA,2025-01-08T13:00:00-05:00,334220,,,ARE
Acquisition of Transformers for Residential Use,PR15019376,"STATE, DEPARTMENT OF","STATE, DEPARTMENT OF",U.S.  EMBASSY BRASILIA,05:20.4,Presolicitation,1/20/2025,,2025-01-05T11:00:00-03:00,,BR-DF,70.403-900,BRA
2025 Italy-wide Electricity Service at DOD Installations,N33191-25-R-ITAELEC,DEPT OF DEFENSE,DEPT OF THE NAVY,NAVFACSYSCOM EUROPE AFRICA CENTRAL,44:42.0,Sources Sought,01-04-25,,2024-12-20T11:00:00+01:00,221122,,,ITA
2025 Italy-wide Natural Gas Service at DOD Installations,N33191-25-R-ITAGAS,DEPT OF DEFENSE,DEPT OF THE NAVY,NAVFACSYSCOM EUROPE AFRICA CENTRAL,40:31.0,Sources Sought,01-04-25,,2024-12-20T11:00:00+01:00,221210,,,ITA
2025 Italy-wide Electricity Service,N33191-25-R-ITAELEC,DEPT OF DEFENSE,DEPT OF THE NAVY,NAVFACSYSCOM EUROPE AFRICA CENTRAL,27:47.1,Sources Sought,01-04-25,,2024-12-20T11:00:00+01:00,221122,,,ITA
Corrosion Prevention and Control,M67854-25-I-5103,DEPT OF DEFENSE,DEPT OF THE NAVY,COMMANDER,17:35.8,Sources Sought,9/30/2025,,2025-01-10T11:00:00-05:00,811121,JP-47,,JPN
Ignitable Liquid Drainage Floor Assembly,N3319124R9010,DEPT OF DEFENSE,DEPT OF THE NAVY,NAVFACSYSCOM EUROPE AFRICA CENTRAL,55:36.2,Justification,01-02-25,,,236210,,,ESP
Maintenance of Two (2) CATISO SCADA Systems,19UK5625Q0016,"STATE, DEPARTMENT OF","STATE, DEPARTMENT OF",U.S. EMBASSY LONDON,47:23.1,Presolicitation,01-02-25,,2024-12-18T17:00:00+00:00,811,GB-LBH,,GBR
RESIDENTIAL MAKE READY SERVICES,19N06025Q0001,"STATE, DEPARTMENT OF","STATE, DEPARTMENT OF",U.S. EMBASSY OSLO,20:43.1,Presolicitation,2/28/2025,,2025-02-14T10:00:00+01:00,236118,,Morgedalsvegen 36,NOR
Fuel(s) for Residences,19CY6025Q0003,"STATE, DEPARTMENT OF","STATE, DEPARTMENT OF",U.S. EMBASSY NICOSIA,10:53.5,Presolicitation,1/17/2025,,,457210,,,CYP
Maintenance and Repair of Fire Control Center (USAG Bavaria),W912PB25R3007,DEPT OF DEFENSE,DEPT OF THE ARMY,0409 AQ HQ     CONTRACT,12:28.5,Solicitation,1/24/2025,,2025-01-09T12:00:00+01:00,561621,DE-BY,,DEU
"Hotel rooms from January 13-16, 2025",19SN1025Q0006,"STATE, DEPARTMENT OF","STATE, DEPARTMENT OF",U.S. EMBASSY SINGAPORE,11:47.1,Solicitation,3/31/2025,,2024-12-20T16:30:00+08:00,721110,,,SGP
RFQ for Lodging and Conference Room Rental in Istanbul April 2025,19tu4625Q1000,"STATE, DEPARTMENT OF","STATE, DEPARTMENT OF",AMERICAN CONSULATE ISTANBUL,18:18.6,Solicitation,01-11-25,,2024-12-27T13:00:00+03:00,72111,TR-34,,TUR
USAID Learning and Evidence Platform,72011125Q00001,AGENCY FOR INTERNATIONAL DEVELOPMENT,AGENCY FOR INTERNATIONAL DEVELOPMENT,USAID/ARMENIA,21:43.1,Solicitation,03-01-25,,2025-01-10T17:00:00+04:00,561990,,82,ARM
USAID Vietnam Innovation Ecosystem,USAID-Vietnam-Innovation-Ecosystem-PreSOL,AGENCY FOR INTERNATIONAL DEVELOPMENT,AGENCY FOR INTERNATIONAL DEVELOPMENT,USAID/VIETNAM,41:47.8,Presolicitation,1/31/2025,,,541990,,,VNM
"//Draft Solicitation// Purchase of Pickup Truck, Yokota Air Base, Japan",FA520925Q0007,DEPT OF DEFENSE,DEPT OF THE AIR FORCE,FA5209  374 CONS PK,40:16.8,Presolicitation,1/21/2025,,2025-01-06T14:00:00+09:00,336110,JP-13,197-0001,JPN
Non-Tactical Vehicle Purchase,W91QVN-25-R-0005,DEPT OF DEFENSE,DEPT OF THE ARMY,0411 AQ HQ     CONTRACT AUG,17:55.8,Solicitation,12/24/2024,,2024-12-09T13:00:00+09:00,336110,KR-41,,KOR
"Hotel rooms and meals in Kuching, Malaysia",19MY3025Q0002,"STATE, DEPARTMENT OF","STATE, DEPARTMENT OF",U.S. EMBASSY KUALA LUMPUR,07:58.9,Solicitation,1/16/2025,,2025-01-01T00:00:00-05:00,531120,MY-13,,MYS
Ammunition Supply Point/Theater Storage Area - Kuwait 3.0,W519TC-25-R-0001,DEPT OF DEFENSE,DEPT OF THE ARMY,W6QK ACC-RI,04:42.1,Solicitation,1/22/2025,,2025-01-07T15:00:00-06:00,561,,,KWT
"Pick up and Disposal of Crushed Waste Glass at Recycle Center Okinawa, Japan",FA5270SS0001,DEPT OF DEFENSE,DEPT OF THE AIR FORCE,FA5270  18 CONS PK,50:02.3,Sources Sought,12/31/2024,,2024-12-16T10:00:00+09:00,5621,JP-47,,JPN
"Solicitation for U.S. Personal Services Contractor (USPSC) as Regional PEPFAR Coordinator, USAID/West Africa, Togo",72062425R00002,AGENCY FOR INTERNATIONAL DEVELOPMENT,AGENCY FOR INTERNATIONAL DEVELOPMENT,USAID/WEST AFRICA REGIONAL,07:18.5,Solicitation,01-02-25,,2025-01-01T23:00:00+00:00,541990,GH-AA,233,GHA
Barriers Maintenance and Repair at USAG-Italy,W912PF25QA001,DEPT OF DEFENSE,DEPT OF THE ARMY,0414 AQ HQ     CONTRACT AUG,31:39.7,Solicitation,12/23/2025,,2024-12-23T14:00:00+01:00,811310,IT-34,9630,ITA
Sole Source BPA set up for Legal Advice,19BE2025Q0019,"STATE, DEPARTMENT OF","STATE, DEPARTMENT OF",U.S. EMBASSY BRUSSELS,16:46.3,Special Notice,12/24/2024,,2024-12-09T12:00:00+01:00,5411,BE-BRU,1000,BEL
Purchase of 57 Color Printers,SP7000-25-RFI-1008,DEPT OF DEFENSE,DEFENSE LOGISTICS AGENCY,DCSO-P NEW CUMBERLAND,03:48.6,Sources Sought,12/24/2024,,2024-12-09T10:00:00-05:00,532420,,,KOR
Fuel Services,19M05525Q0001,"STATE, DEPARTMENT OF","STATE, DEPARTMENT OF",U.S. EMBASSY RABAT,44:11.0,Solicitation,7/31/2025,LAS,2025-01-10T16:45:00+01:00,457,MA-25,,MAR
727 AMS - SHORING KIT,FA558725Q0009,DEPT OF DEFENSE,DEPT OF THE AIR FORCE,FA5587  48 CONS,01:55.8,Combined Synopsis/Solicitation,12/28/2024,,2024-12-13T14:00:00+00:00,336413,,,GBR
"USAID Architecture and Engineering (A&E), Design and Construction Oversight Activity in the Southern Africa Region",72067425RFI00001,AGENCY FOR INTERNATIONAL DEVELOPMENT,AGENCY FOR INTERNATIONAL DEVELOPMENT,USAID/SOUTH AFRICA,51:39.0,Special Notice,2/15/2025,,2025-01-31T17:00:00+02:00,,ZA-GT,181,ZAF
"Notice of Opportunity (NOO) for Energy Savings Performance Contract (ESPC) - Royal Air Force Mildenhall, United Kingdom",SP060425R0400,DEPT OF DEFENSE,DEFENSE LOGISTICS AGENCY,DLA ENERGY,02:29.0,Solicitation,12/24/2024,,2024-12-09T15:00:00-05:00,541330,GB-SFK,,GBR
NATO Business Opportunity: Acquisition and Installation of Link 22 Tactical Data Link (TDL) Test Capability at NATO SWACR Ranges,IFB-CO-423300-SSSB,"COMMERCE, DEPARTMENT OF",BUREAU OF INDUSTRY AND SECURITY,BUREAU OF INDUSTRY AND SECURITY,30:12.5,Special Notice,01-11-25,,2025-01-07T17:00:00-05:00,541519,,,GRC
Solicitation for U.S. Personal Services Contractor (USPSC) or Third Country National Personal Services Contractor (TCNPSC) for the Position of a Supervisory General Services Specialist,72066825R00002,AGENCY FOR INTERNATIONAL DEVELOPMENT,AGENCY FOR INTERNATIONAL DEVELOPMENT,USAID/SOUTH SUDAN,29:46.4,Combined Synopsis/Solicitation,1/24/2025,,2025-01-09T15:00:00-05:00,812990,,,SSD
US Embassy Athens Generator Diesel Oil,19GR1025Q0011,"STATE, DEPARTMENT OF","STATE, DEPARTMENT OF",AMERICAN EMBASSY ATHENS,07:50.9,Solicitation,1/13/2025,,2024-12-13T13:00:00+02:00,424720,GR-I,10160,GRC
N00383-25-Q-035N,N00383-25-Q-035N,DEPT OF DEFENSE,DEPT OF THE NAVY,NAVSUP WEAPON SYSTEMS SUPPORT,54:39.7,Solicitation,01-02-25,,2025-01-02T17:00:00-05:00,334511,,,ESP
MSG Cook Services,19HR9025Q002,"STATE, DEPARTMENT OF","STATE, DEPARTMENT OF",U.S. EMBASSY ZAGREB,46:02.4,Presolicitation,01-07-25,,2024-12-23T00:00:00+01:00,8129,HR-21,10000,HRV
Construction Inspection Services for the Chief of Mission Residence,19KV4225Q0003,"STATE, DEPARTMENT OF","STATE, DEPARTMENT OF",U.S. EMBASSY PRISTINA,36:42.8,Presolicitation,1/25/2025,,2025-01-10T00:00:00+01:00,541350,XK-26,10000,XKS
"Demolish Bldg. No. S-1330, BSF",W90VN925R0006,DEPT OF DEFENSE,DEPT OF THE ARMY,646TH SUPPORT DETACHMENT,52:01.5,Combined Synopsis/Solicitation,12/24/2024,,2024-12-09T13:00:00+09:00,23622,,,KOR
Embassy Apia Tactical Gear Items,19NZ9525Q0002,"STATE, DEPARTMENT OF","STATE, DEPARTMENT OF",U.S. EMBASSY WELLINGTON,25:28.2,Solicitation,12/31/2024,,2024-12-16T17:00:00+13:00,315990,,,WSM
Embassy Wellington Vehicle Solicitation,19NZ9525Q0005,"STATE, DEPARTMENT OF","STATE, DEPARTMENT OF",U.S. EMBASSY WELLINGTON,21:39.6,Solicitation,12/31/2025,,2025-12-16T17:00:00+13:00,3361,,6011,NZL
Pest Control Service,19SA4025R0002,"STATE, DEPARTMENT OF","STATE, DEPARTMENT OF",AMERICAN CONSULATE JEDDAH,12:06.0,Presolicitation,2/14/2025,,2025-01-30T17:00:00+03:00,56171,SA-02,21411,SAU
Western Pacific (WESTPAC) Bulk Petroleum Products Program,SPE60223R0706,DEPT OF DEFENSE,DEFENSE LOGISTICS AGENCY,DLA ENERGY,17:54.4,Justification,12/29/2024,,,324110,,,QAT
Western Pacific (WESTPAC) Bulk Petroleum Products Program,SPE60223R0706,DEPT OF DEFENSE,DEFENSE LOGISTICS AGENCY,DLA ENERGY,12:32.5,Justification,12/29/2024,,,324110,,,QAT
Country Program Coordinator for Cape Verde,20341925R00001,"TREASURY, DEPARTMENT OF THE",BUREAU OF THE FISCAL SERVICE,ARC DIV PROC SVCS - ADF,30:42.8,Solicitation,1/18/2025,,2025-01-03T14:00:00-05:00,541511,CV-PR,,CPV
INL Guatemala: IT Equipment- Servers,191NLE25Q0021,"STATE, DEPARTMENT OF","STATE, DEPARTMENT OF",ACQUISITIONS - INL,29:23.4,Combined Synopsis/Solicitation,12/27/2024,SBA,2024-12-12T09:00:00-05:00,541519,,,GTM
INL Guatemala IT Equipment- Servers,191NLE25Q0021,"STATE, DEPARTMENT OF","STATE, DEPARTMENT OF",ACQUISITIONS - INL,27:59.9,Combined Synopsis/Solicitation,12/27/2024,SBA,2024-12-12T09:00:00-05:00,541519,,,GTM
"Optimizing Food Assistance Programs, Processes and Products for Nutrition (O3P)",7200AA24R00105,AGENCY FOR INTERNATIONAL DEVELOPMENT,AGENCY FOR INTERNATIONAL DEVELOPMENT,BUREAU FOR HUMANITARIAN ASSISTANCE,43:34.3,Solicitation,12/31/2024,,2024-12-16T16:00:00-05:00,541611,N/A,,AX1
"De-Icing Material for Runway, Airfield, Roads, Sidewalks",W912CM25Q0001,DEPT OF DEFENSE,DEPT OF THE ARMY,0409 AQ HQ     CONTRACT =,49:07.8,Combined Synopsis/Solicitation,12/24/2024,LAS,2024-12-09T15:00:00+01:00,325998,DE-HE,65187,DEU
Cook services,19FR6325Q0006,"STATE, DEPARTMENT OF","STATE, DEPARTMENT OF",U.S. EMBASSY PARIS,54:59.0,Solicitation,01-02-25,,2024-12-18T16:00:00+01:00,722310,,,FRA
INL_RFQ-PR15000541 - CONSTRUCTION MATERIALS POPAYÁN,INL_RFQ-PR15000541,"STATE, DEPARTMENT OF","STATE, DEPARTMENT OF",AMERICAN EMBASSY BOGOTA - NAS,34:06.8,Combined Synopsis/Solicitation,12/31/2024,,2024-12-16T16:00:00-05:00,327999,,,COL
INL_RFQ-PR14992750 - BREATHING APPARATUSES FOR NAVY TRAINNING,INL_RFQ-PR14992750,"STATE, DEPARTMENT OF","STATE, DEPARTMENT OF",AMERICAN EMBASSY BOGOTA - NAS,30:12.2,Combined Synopsis/Solicitation,01-02-25,,2024-12-18T16:00:00-05:00,339920,,,COL
RFQ-Request for Quotations for SRWF Installation Services 25-Q-3001,19TU15-25-Q-3001,"STATE, DEPARTMENT OF","STATE, DEPARTMENT OF",U.S. EMBASSY ANKARA,42:23.2,Solicitation,1/31/2025,,2024-12-20T16:00:00+03:00,523,,,TUR
Landscaping Services,19GB5024Q0003,"STATE, DEPARTMENT OF","STATE, DEPARTMENT OF",U.S. EMBASSY LIBREVILLE,52:32.7,Presolicitation,11/28/2025,,2024-11-29T13:00:00+00:00,561730,GA-1,4000,GAB
RFQ for Press and Publicity Management USAID Pakistan,72039125Q00001,AGENCY FOR INTERNATIONAL DEVELOPMENT,AGENCY FOR INTERNATIONAL DEVELOPMENT,USAID/PAKISTAN,43:07.9,Solicitation,12/16/2025,,2024-12-16T17:00:00+05:00,5418,PK-IS,44000,PAK
Ashgabat Post: SUV procurement,PR15016054,"STATE, DEPARTMENT OF","STATE, DEPARTMENT OF",U.S. EMBASSY ASHGABAT,04:16.6,Presolicitation,12/28/2024,,2024-12-13T17:00:00+05:00,3361,TM-S,744000,TKM
RFI- Rwanda Market Systems for Livestock Activity (MSLA),RFI69625000001,AGENCY FOR INTERNATIONAL DEVELOPMENT,AGENCY FOR INTERNATIONAL DEVELOPMENT,USAID/RWANDA,31:50.1,Sources Sought,3/15/2025,,2024-12-19T17:00:00-05:00,,RW-01,,RWA
Ammunition Supply Point/Theater Storage Area - Kuwait 3.0,W519TC-25-R-0001,DEPT OF DEFENSE,DEPT OF THE ARMY,W6QK ACC-RI,47:27.5,Solicitation,1/22/2025,,2025-01-07T15:00:00-06:00,561,,,KWT
"US Mission Kampala, Uganda",19AQMM24R0163,"STATE, DEPARTMENT OF","STATE, DEPARTMENT OF",ACQUISITIONS - AQM MOMENTUM,02:03.5,Solicitation,12/28/2024,,2024-12-13T13:00:00-05:00,561612,,,UGA
"Design-Build Construct Primary & Secondary School, Rachelu, Romania.",N3319125R9003,DEPT OF DEFENSE,DEPT OF THE NAVY,NAVFACSYSCOM EUROPE AFRICA CENTRAL,02:49.9,Presolicitation,10-01-25,,2024-12-12T14:00:00+01:00,236220,RO-TL,,ROU
Cyprus Industry Day on 18th December 2024,,DEPT OF DEFENSE,DEPT OF THE NAVY,NAVFACSYSCOM EUROPE AFRICA CENTRAL,19:39.9,Special Notice,12/28/2024,,2024-12-13T14:00:00+01:00,236210,CY-06,,CYP
US Mission Portugal Local Guard Services,PR14996074,"STATE, DEPARTMENT OF","STATE, DEPARTMENT OF",ACQUISITIONS - AQM MOMENTUM,12:35.1,Sources Sought,12/31/2024,,2024-12-16T13:00:00-05:00,561612,,,PRT
RFQ 19PE5025Q0007 - MSG - Bicycles,19PE5025Q0007,"STATE, DEPARTMENT OF","STATE, DEPARTMENT OF",U.S.EMBASSY LIMA,38:41.2,Solicitation,12/27/2024,,2024-12-12T11:00:00-05:00,441227,PE-LIM,,PER
FRI for Rwanda Market Systems for Livestock Activity (MSLA),RFI69625000001,AGENCY FOR INTERNATIONAL DEVELOPMENT,AGENCY FOR INTERNATIONAL DEVELOPMENT,USAID/RWANDA,29:06.4,Sources Sought,3/15/2025,,2024-12-19T17:00:00-05:00,,RW-01,,RWA
N33191-24-R-0031 Design-Build (D-B) Construct Maintenance Facility and Technical Training Center in Djibouti,N3319124R0031,DEPT OF DEFENSE,DEPT OF THE NAVY,NAVFACSYSCOM EUROPE AFRICA CENTRAL,22:12.4,Solicitation,11/27/2025,,2025-01-08T14:00:00+01:00,236210,,,DJI
N33191-24-R-0031 Design-Build (D-B) Construct Maintenance Facility and Technical Training Center in Djibouti,N3319124R0031,DEPT OF DEFENSE,DEPT OF THE NAVY,NAVFACSYSCOM EUROPE AFRICA CENTRAL,14:47.5,Solicitation,11/27/2025,,2025-01-08T14:00:00+01:00,236210,,,DJI
"USAID “Support for Trade, Recovery Opportunities, and National Growth in Ukraine (STRONG UA) Activity”",SOL-72012124R00020,AGENCY FOR INTERNATIONAL DEVELOPMENT,AGENCY FOR INTERNATIONAL DEVELOPMENT,USAID/UKRAINE,43:10.1,Solicitation,1/21/2025,,2025-01-06T16:00:00+02:00,541611,UA-30,,UKR
"Landline Telephone services for the U.S. Embassy Athens, Greece.",19GR10-25-Q-0007,"STATE, DEPARTMENT OF","STATE, DEPARTMENT OF",AMERICAN EMBASSY ATHENS,22:03.4,Solicitation,12/31/2024,,2024-12-04T12:00:00+02:00,517112,GR-I,,GRC
NATO Market Survey: Advanced Analytics for the Alliance Persistent Surveillance from Space (APSS) Program,MS-CO-42337-APSS,"COMMERCE, DEPARTMENT OF",BUREAU OF INDUSTRY AND SECURITY,BUREAU OF INDUSTRY AND SECURITY,05:29.2,Special Notice,01-01-25,,2024-12-31T17:00:00+01:00,541519,,,BEL
RFQ PR15004112 CONSTRUCTION MATERIAL SAN LUIS TOLIMA COLOMBIA,PR15004112_CONSTRUCTION_MATERIAL_SAN_LUIS_TOLIMA_COLOMBIA,"STATE, DEPARTMENT OF","STATE, DEPARTMENT OF",AMERICAN EMBASSY BOGOTA - NAS,03:59.8,Combined Synopsis/Solicitation,12/28/2024,,2024-12-13T16:00:00-05:00,42339,,,COL
PR 12210825 - Clinical Laundry Service,PR0012210825,DEPT OF DEFENSE,DEFENSE HEALTH AGENCY (DHA),DEFENSE HEALTH AGENCY,03:38.1,Solicitation,12/21/2024,,2024-12-06T12:00:00-05:00,812320,,,DEU
RFQ PR15006433 CONSTRUCTION MATERIAL BUENAVENTURA COLOMBIA,PR15006433_CONSTRUCTION_MATERIAL_BUENAVENTURA_COLOMBIA,"STATE, DEPARTMENT OF","STATE, DEPARTMENT OF",AMERICAN EMBASSY BOGOTA - NAS,00:36.1,Combined Synopsis/Solicitation,12/28/2024,,2024-12-13T16:00:00-05:00,42339,,,COL
Travel Management Contract,19KV4225Q0001,"STATE, DEPARTMENT OF","STATE, DEPARTMENT OF",U.S. EMBASSY PRISTINA,25:54.2,Solicitation,12/31/2024,,2024-12-16T15:00:00+01:00,56151,XK-26,10000,XKS
Make Ready Painting Services,19AU9025R0001,"STATE, DEPARTMENT OF","STATE, DEPARTMENT OF",U.S. EMBASSY VIENNA,55:00.3,Solicitation,1/14/2025,,2024-12-30T10:00:00+01:00,238320,AT-9,,AUT
External Audit on LE Staff Health Insurance,PR14993257,"STATE, DEPARTMENT OF","STATE, DEPARTMENT OF",U.S. EMBASSY MANAMA,43:40.0,Combined Synopsis/Solicitation,12/24/2024,,2024-12-09T16:00:00+03:00,813920,,,BHR
Air Charter and Ground Transportation Services,FA568525QC001,DEPT OF DEFENSE,DEPT OF THE AIR FORCE,FA5685  39 CONS LGC,17:41.7,Combined Synopsis/Solicitation,12/28/2024,,2024-12-13T12:00:00+03:00,481211,AM-ER,,ARM
Quarterly radio tower maintenance,PR14951227 ,"STATE, DEPARTMENT OF","STATE, DEPARTMENT OF",U.S. EMBASSY BRAZZAVILLE,59:02.6,Combined Synopsis/Solicitation,01-08-25,LAS,2024-12-24T07:00:00-05:00,8112,CG-BZV,,COG
CCTV System Upgrade at Official Residence,19SF2025Q0003,"STATE, DEPARTMENT OF","STATE, DEPARTMENT OF",AMERICAN CONSULATE CAPE TOWN,35:45.7,Solicitation,12/27/2024,,2024-12-12T09:00:00+02:00,56162,ZA-WC,7495,ZAF
MAKE READY SERVICES FOR U.S. DIPLOMATIC RESIDENCES,19UP3025R0001,"STATE, DEPARTMENT OF","STATE, DEPARTMENT OF",U.S. EMBASSY KYIV,51:03.0,Combined Synopsis/Solicitation,01-02-25,,2024-12-18T05:00:00+02:00,236118,UA-30,4112,UKR
PM Service Swimming Pool & Fountains,19SA4025Q0002,"STATE, DEPARTMENT OF","STATE, DEPARTMENT OF",AMERICAN CONSULATE JEDDAH,33:42.1,Combined Synopsis/Solicitation,1/31/2025,,2025-01-16T17:00:00+03:00,561790,SA-02,21411,SAU
BPA for Rental of Residential Furniture,191T5225Q0001,"STATE, DEPARTMENT OF","STATE, DEPARTMENT OF",AMERICAN CONSULATE MILAN,02:38.0,Presolicitation,11/25/2025,,,532289,IT-MI,,ITA
RSU GROUND HANDLING SERVICES SOLICITATION,19RC1124Q0001,"STATE, DEPARTMENT OF","STATE, DEPARTMENT OF",REGIONAL SUPPORT CENTER – AMMAN,21:55.8,Special Notice,12/23/2024,,2024-12-08T16:30:00+03:00,488190,JO-AM,11118,JOR
F-35 Pylon Storage Stand,FA520525QB007,DEPT OF DEFENSE,DEPT OF THE AIR FORCE,FA5205  35 CONS PK,20:23.5,Combined Synopsis/Solicitation,12/24/2024,,2024-12-09T13:00:00+09:00,332510,JP-02,96319,JPN
"Supply Explosives Trace Detector Equipment for U.S Embassy, Vientiane",19LA9025Q0001,"STATE, DEPARTMENT OF","STATE, DEPARTMENT OF",U.S. EMBASSY VIENTIANE,12:30.6,Solicitation,12/26/2024,,2024-12-11T23:59:00+07:00,334519,,,LAO
HVAC WATER TREATMENT SERVICES FOR U.S. EMBASSY PHILIPPINES,19RP3825Q0016,"STATE, DEPARTMENT OF","STATE, DEPARTMENT OF",U.S. EMBASSY MANILA,26:15.1,Presolicitation,11/30/2025,,,221310,,,PHL
"INSTALL SURGE PROTECTION DEVICES AT NAVY MUNITIONS AREA, MISAWA AIR BASE, JAPANB.",N4008425T7001,DEPT OF DEFENSE,DEPT OF THE NAVY,NAVFACSYSCOM FAR EAST,24:28.0,Solicitation,11/27/2025,,2024-12-23T11:00:00+09:00,238210,,,JPN
"INSTALL SURGE PROTECTION DEVICES AT NAVY MUNITIONS AREA, MISAWA, JAPAN",N4008425T7001,DEPT OF DEFENSE,DEPT OF THE NAVY,NAVFACSYSCOM FAR EAST,07:26.8,Solicitation,01-07-25,,2024-12-23T11:00:00+09:00,238210,,,JPN
